{
  "$schema": "https://json-schema.org/draft/2020-12/schema",
  "title": "TraceCanary v1 contract",
  "type": "object",
  "additionalProperties": false,
  "required": ["contract_version", "semantic_conventions_version", "canaries", "required_retained_fields"],
  "properties": {
    "contract_version": {"const": "tracecanary/v1"},
    "semantic_conventions_version": {"const": "opentelemetry/semconv/1.43.0"},
    "canaries": {
      "type": "array", "minItems": 1, "uniqueItems": true,
      "items": {"type": "object", "additionalProperties": false, "required": ["label", "category", "value"], "properties": {
        "label": {"type": "string", "minLength": 1}, "category": {"type": "string", "minLength": 1}, "value": {"type": "string", "minLength": 1}
      }}
    },
    "forbidden_attribute_keys": {"type": "array", "items": {"type": "string", "minLength": 1}, "uniqueItems": true},
    "forbidden_attribute_key_prefixes": {"type": "array", "items": {"type": "string", "minLength": 1}, "uniqueItems": true},
    "forbidden_path_prefixes": {"type": "array", "items": {"type": "string", "pattern": "^/"}, "uniqueItems": true},
    "required_retained_fields": {"type": "array", "items": {"type": "object", "additionalProperties": false, "required": ["scope", "key"], "properties": {
      "scope": {"enum": ["resource", "span", "event"]}, "key": {"type": "string", "minLength": 1}
    }}},
    "limits": {"type": "object", "additionalProperties": false, "properties": {
      "max_input_bytes": {"type": "integer", "minimum": 1024, "maximum": 50000000, "default": 5000000},
      "max_nesting": {"type": "integer", "minimum": 2, "maximum": 1000, "default": 100},
      "max_batch_files": {"type": "integer", "minimum": 1, "maximum": 10000, "default": 256}
    }}
  }
}
